Class,Subject,Chapter,Question,Option A,Option B,Option C,Option D,Correct Option,Difficulty
12,Biology,Reproductive Health,"Q-ID-231: Regarding the sexually transmitted infection 'HIV/AIDS', what is an important preventive measure for a healthy society?",Sharing infected needles.,Avoiding vaccination.,Using condoms during coitus and avoiding unknown partners.,Using copper IUDs.,C,easy
12,Biology,Reproductive Health,"Q-ID-232: Regarding the sexually transmitted infection 'Gonorrhea', what is an important preventive measure for a healthy society?",Using condoms during coitus and avoiding unknown partners.,Sharing infected needles.,Avoiding vaccination.,Using copper IUDs.,A,easy
12,Biology,Reproductive Health,"Q-ID-233: Regarding the sexually transmitted infection 'Chlamydiasis', what is an important preventive measure for a healthy society?",Sharing infected needles.,Avoiding vaccination.,Using condoms during coitus and avoiding unknown partners.,Using copper IUDs.,C,easy
12,Biology,Reproductive Health,"Q-ID-234: Regarding the sexually transmitted infection 'Trichomoniasis', what is an important preventive measure for a healthy society?",Using copper IUDs.,Sharing infected needles.,Using condoms during coitus and avoiding unknown partners.,Avoiding vaccination.,C,easy
12,Biology,Reproductive Health,"Q-ID-235: Regarding the sexually transmitted infection 'Gonorrhea', what is an important preventive measure for a healthy society?",Avoiding vaccination.,Using condoms during coitus and avoiding unknown partners.,Using copper IUDs.,Sharing infected needles.,B,easy
12,Biology,Reproductive Health,"Q-ID-236: Regarding the sexually transmitted infection 'Genital herpes', what is an important preventive measure for a healthy society?",Using copper IUDs.,Avoiding vaccination.,Using condoms during coitus and avoiding unknown partners.,Sharing infected needles.,C,easy
12,Biology,Reproductive Health,"Q-ID-237: Regarding the sexually transmitted infection 'Genital herpes', what is an important preventive measure for a healthy society?",Using condoms during coitus and avoiding unknown partners.,Using copper IUDs.,Sharing infected needles.,Avoiding vaccination.,A,easy
12,Biology,Reproductive Health,"Q-ID-238: Regarding the sexually transmitted infection 'Syphilis', what is an important preventive measure for a healthy society?",Using condoms during coitus and avoiding unknown partners.,Avoiding vaccination.,Using copper IUDs.,Sharing infected needles.,A,easy
12,Biology,Reproductive Health,"Q-ID-239: Regarding the sexually transmitted infection 'Genital herpes', what is an important preventive measure for a healthy society?",Sharing infected needles.,Using condoms during coitus and avoiding unknown partners.,Avoiding vaccination.,Using copper IUDs.,B,easy
12,Biology,Reproductive Health,"Q-ID-240: Regarding the sexually transmitted infection 'Hepatitis-B', what is an important preventive measure for a healthy society?",Using condoms during coitus and avoiding unknown partners.,Using copper IUDs.,Avoiding vaccination.,Sharing infected needles.,A,easy
12,Biology,Reproductive Health,"Q-ID-241: Regarding the sexually transmitted infection 'Gonorrhea', what is an important preventive measure for a healthy society?",Sharing infected needles.,Avoiding vaccination.,Using condoms during coitus and avoiding unknown partners.,Using copper IUDs.,C,easy
12,Biology,Reproductive Health,"Q-ID-242: Regarding the sexually transmitted infection 'Syphilis', what is an important preventive measure for a healthy society?",Sharing infected needles.,Using copper IUDs.,Using condoms during coitus and avoiding unknown partners.,Avoiding vaccination.,C,easy
12,Biology,Reproductive Health,"Q-ID-243: Regarding the sexually transmitted infection 'Trichomoniasis', what is an important preventive measure for a healthy society?",Using copper IUDs.,Sharing infected needles.,Using condoms during coitus and avoiding unknown partners.,Avoiding vaccination.,C,easy
12,Biology,Reproductive Health,"Q-ID-244: Regarding the sexually transmitted infection 'Chlamydiasis', what is an important preventive measure for a healthy society?",Avoiding vaccination.,Sharing infected needles.,Using copper IUDs.,Using condoms during coitus and avoiding unknown partners.,D,easy
12,Biology,Reproductive Health,"Q-ID-245: Regarding the sexually transmitted infection 'Genital warts', what is an important preventive measure for a healthy society?",Using condoms during coitus and avoiding unknown partners.,Avoiding vaccination.,Sharing infected needles.,Using copper IUDs.,A,easy
12,Biology,Reproductive Health,"Q-ID-246: Regarding the sexually transmitted infection 'Gonorrhea', what is an important preventive measure for a healthy society?",Using copper IUDs.,Sharing infected needles.,Using condoms during coitus and avoiding unknown partners.,Avoiding vaccination.,C,easy
12,Biology,Reproductive Health,"Q-ID-247: Regarding the sexually transmitted infection 'Genital warts', what is an important preventive measure for a healthy society?",Using condoms during coitus and avoiding unknown partners.,Sharing infected needles.,Avoiding vaccination.,Using copper IUDs.,A,easy
12,Biology,Reproductive Health,"Q-ID-248: Regarding the sexually transmitted infection 'Syphilis', what is an important preventive measure for a healthy society?",Avoiding vaccination.,Sharing infected needles.,Using condoms during coitus and avoiding unknown partners.,Using copper IUDs.,C,easy
12,Biology,Reproductive Health,"Q-ID-249: Regarding the sexually transmitted infection 'HIV/AIDS', what is an important preventive measure for a healthy society?",Using condoms during coitus and avoiding unknown partners.,Avoiding vaccination.,Sharing infected needles.,Using copper IUDs.,A,easy
12,Biology,Reproductive Health,"Q-ID-250: Regarding the sexually transmitted infection 'Genital warts', what is an important preventive measure for a healthy society?",Avoiding vaccination.,Sharing infected needles.,Using condoms during coitus and avoiding unknown partners.,Using copper IUDs.,C,easy
12,Biology,Reproductive Health,"Q-ID-251: Regarding the sexually transmitted infection 'HIV/AIDS', what is an important preventive measure for a healthy society?",Avoiding vaccination.,Sharing infected needles.,Using condoms during coitus and avoiding unknown partners.,Using copper IUDs.,C,easy
12,Biology,Reproductive Health,"Q-ID-252: Regarding the sexually transmitted infection 'Gonorrhea', what is an important preventive measure for a healthy society?",Avoiding vaccination.,Using condoms during coitus and avoiding unknown partners.,Using copper IUDs.,Sharing infected needles.,B,easy
12,Biology,Reproductive Health,"Q-ID-253: Regarding the sexually transmitted infection 'Hepatitis-B', what is an important preventive measure for a healthy society?",Sharing infected needles.,Using copper IUDs.,Using condoms during coitus and avoiding unknown partners.,Avoiding vaccination.,C,easy
12,Biology,Reproductive Health,"Q-ID-254: Regarding the sexually transmitted infection 'Genital herpes', what is an important preventive measure for a healthy society?",Using copper IUDs.,Sharing infected needles.,Avoiding vaccination.,Using condoms during coitus and avoiding unknown partners.,D,easy
12,Biology,Reproductive Health,"Q-ID-255: Regarding the sexually transmitted infection 'Genital warts', what is an important preventive measure for a healthy society?",Using condoms during coitus and avoiding unknown partners.,Using copper IUDs.,Avoiding vaccination.,Sharing infected needles.,A,easy
12,Biology,Reproductive Health,"Q-ID-256: Regarding the sexually transmitted infection 'Chlamydiasis', what is an important preventive measure for a healthy society?",Sharing infected needles.,Using condoms during coitus and avoiding unknown partners.,Avoiding vaccination.,Using copper IUDs.,B,easy
12,Biology,Reproductive Health,"Q-ID-257: Regarding the sexually transmitted infection 'Genital herpes', what is an important preventive measure for a healthy society?",Using condoms during coitus and avoiding unknown partners.,Avoiding vaccination.,Sharing infected needles.,Using copper IUDs.,A,easy
12,Biology,Reproductive Health,"Q-ID-258: Regarding the sexually transmitted infection 'Chlamydiasis', what is an important preventive measure for a healthy society?",Sharing infected needles.,Using copper IUDs.,Avoiding vaccination.,Using condoms during coitus and avoiding unknown partners.,D,easy
12,Biology,Reproductive Health,"Q-ID-259: Regarding the sexually transmitted infection 'Trichomoniasis', what is an important preventive measure for a healthy society?",Avoiding vaccination.,Sharing infected needles.,Using copper IUDs.,Using condoms during coitus and avoiding unknown partners.,D,easy
12,Biology,Reproductive Health,"Q-ID-260: Regarding the sexually transmitted infection 'Genital herpes', what is an important preventive measure for a healthy society?",Using condoms during coitus and avoiding unknown partners.,Avoiding vaccination.,Sharing infected needles.,Using copper IUDs.,A,easy
12,Biology,Reproductive Health,"Q-ID-261: Regarding the sexually transmitted infection 'Gonorrhea', what is an important preventive measure for a healthy society?",Using copper IUDs.,Avoiding vaccination.,Using condoms during coitus and avoiding unknown partners.,Sharing infected needles.,C,easy
12,Biology,Reproductive Health,"Q-ID-262: Regarding the sexually transmitted infection 'Hepatitis-B', what is an important preventive measure for a healthy society?",Sharing infected needles.,Using condoms during coitus and avoiding unknown partners.,Using copper IUDs.,Avoiding vaccination.,B,easy
12,Biology,Reproductive Health,"Q-ID-263: Regarding the sexually transmitted infection 'Hepatitis-B', what is an important preventive measure for a healthy society?",Using condoms during coitus and avoiding unknown partners.,Using copper IUDs.,Avoiding vaccination.,Sharing infected needles.,A,easy
12,Biology,Reproductive Health,"Q-ID-264: Regarding the sexually transmitted infection 'Syphilis', what is an important preventive measure for a healthy society?",Sharing infected needles.,Using condoms during coitus and avoiding unknown partners.,Using copper IUDs.,Avoiding vaccination.,B,easy
12,Biology,Reproductive Health,"Q-ID-265: Regarding the sexually transmitted infection 'Genital warts', what is an important preventive measure for a healthy society?",Sharing infected needles.,Avoiding vaccination.,Using copper IUDs.,Using condoms during coitus and avoiding unknown partners.,D,easy
12,Biology,Reproductive Health,"Q-ID-266: Regarding the sexually transmitted infection 'Genital warts', what is an important preventive measure for a healthy society?",Using copper IUDs.,Sharing infected needles.,Avoiding vaccination.,Using condoms during coitus and avoiding unknown partners.,D,easy
12,Biology,Reproductive Health,"Q-ID-267: Regarding the sexually transmitted infection 'Genital herpes', what is an important preventive measure for a healthy society?",Using copper IUDs.,Using condoms during coitus and avoiding unknown partners.,Sharing infected needles.,Avoiding vaccination.,B,easy
12,Biology,Reproductive Health,"Q-ID-268: Regarding the sexually transmitted infection 'Genital warts', what is an important preventive measure for a healthy society?",Using copper IUDs.,Using condoms during coitus and avoiding unknown partners.,Sharing infected needles.,Avoiding vaccination.,B,easy
12,Biology,Reproductive Health,"Q-ID-269: Regarding the sexually transmitted infection 'Genital herpes', what is an important preventive measure for a healthy society?",Using condoms during coitus and avoiding unknown partners.,Avoiding vaccination.,Sharing infected needles.,Using copper IUDs.,A,easy
12,Biology,Reproductive Health,"Q-ID-270: Regarding the sexually transmitted infection 'Genital herpes', what is an important preventive measure for a healthy society?",Using condoms during coitus and avoiding unknown partners.,Using copper IUDs.,Sharing infected needles.,Avoiding vaccination.,A,easy
12,Biology,Reproductive Health,"Q-ID-271: Regarding the sexually transmitted infection 'Genital warts', what is an important preventive measure for a healthy society?",Sharing infected needles.,Using copper IUDs.,Using condoms during coitus and avoiding unknown partners.,Avoiding vaccination.,C,easy
12,Biology,Reproductive Health,"Q-ID-272: Regarding the sexually transmitted infection 'HIV/AIDS', what is an important preventive measure for a healthy society?",Sharing infected needles.,Using condoms during coitus and avoiding unknown partners.,Using copper IUDs.,Avoiding vaccination.,B,easy
12,Biology,Reproductive Health,"Q-ID-273: Regarding the sexually transmitted infection 'Syphilis', what is an important preventive measure for a healthy society?",Using copper IUDs.,Using condoms during coitus and avoiding unknown partners.,Sharing infected needles.,Avoiding vaccination.,B,easy
12,Biology,Reproductive Health,"Q-ID-274: Regarding the sexually transmitted infection 'Hepatitis-B', what is an important preventive measure for a healthy society?",Using copper IUDs.,Sharing infected needles.,Avoiding vaccination.,Using condoms during coitus and avoiding unknown partners.,D,easy
12,Biology,Reproductive Health,"Q-ID-275: Regarding the sexually transmitted infection 'Trichomoniasis', what is an important preventive measure for a healthy society?",Using copper IUDs.,Sharing infected needles.,Avoiding vaccination.,Using condoms during coitus and avoiding unknown partners.,D,easy
12,Biology,Reproductive Health,"Q-ID-276: Regarding the sexually transmitted infection 'Syphilis', what is an important preventive measure for a healthy society?",Using condoms during coitus and avoiding unknown partners.,Sharing infected needles.,Avoiding vaccination.,Using copper IUDs.,A,easy
12,Biology,Reproductive Health,"Q-ID-277: Regarding the sexually transmitted infection 'Syphilis', what is an important preventive measure for a healthy society?",Sharing infected needles.,Avoiding vaccination.,Using condoms during coitus and avoiding unknown partners.,Using copper IUDs.,C,easy
12,Biology,Reproductive Health,"Q-ID-278: Regarding the sexually transmitted infection 'Trichomoniasis', what is an important preventive measure for a healthy society?",Using copper IUDs.,Avoiding vaccination.,Using condoms during coitus and avoiding unknown partners.,Sharing infected needles.,C,easy
12,Biology,Reproductive Health,"Q-ID-279: Regarding the sexually transmitted infection 'Gonorrhea', what is an important preventive measure for a healthy society?",Avoiding vaccination.,Using condoms during coitus and avoiding unknown partners.,Using copper IUDs.,Sharing infected needles.,B,easy
12,Biology,Reproductive Health,"Q-ID-280: Regarding the sexually transmitted infection 'Genital herpes', what is an important preventive measure for a healthy society?",Using copper IUDs.,Sharing infected needles.,Using condoms during coitus and avoiding unknown partners.,Avoiding vaccination.,C,easy
12,Biology,Reproductive Health,"Q-ID-281: Regarding the sexually transmitted infection 'Hepatitis-B', what is an important preventive measure for a healthy society?",Avoiding vaccination.,Sharing infected needles.,Using condoms during coitus and avoiding unknown partners.,Using copper IUDs.,C,easy
12,Biology,Reproductive Health,"Q-ID-282: Regarding the sexually transmitted infection 'HIV/AIDS', what is an important preventive measure for a healthy society?",Sharing infected needles.,Using condoms during coitus and avoiding unknown partners.,Using copper IUDs.,Avoiding vaccination.,B,easy
12,Biology,Reproductive Health,"Q-ID-283: Regarding the sexually transmitted infection 'Hepatitis-B', what is an important preventive measure for a healthy society?",Avoiding vaccination.,Using copper IUDs.,Using condoms during coitus and avoiding unknown partners.,Sharing infected needles.,C,easy
12,Biology,Reproductive Health,"Q-ID-284: Regarding the sexually transmitted infection 'Chlamydiasis', what is an important preventive measure for a healthy society?",Using condoms during coitus and avoiding unknown partners.,Using copper IUDs.,Sharing infected needles.,Avoiding vaccination.,A,easy
12,Biology,Reproductive Health,"Q-ID-285: Regarding the sexually transmitted infection 'Genital herpes', what is an important preventive measure for a healthy society?",Using copper IUDs.,Using condoms during coitus and avoiding unknown partners.,Sharing infected needles.,Avoiding vaccination.,B,easy
12,Biology,Reproductive Health,"Q-ID-286: Regarding the sexually transmitted infection 'Hepatitis-B', what is an important preventive measure for a healthy society?",Using condoms during coitus and avoiding unknown partners.,Avoiding vaccination.,Using copper IUDs.,Sharing infected needles.,A,easy
12,Biology,Reproductive Health,"Q-ID-287: Regarding the sexually transmitted infection 'Hepatitis-B', what is an important preventive measure for a healthy society?",Avoiding vaccination.,Using copper IUDs.,Using condoms during coitus and avoiding unknown partners.,Sharing infected needles.,C,easy
12,Biology,Reproductive Health,"Q-ID-288: Regarding the sexually transmitted infection 'Chlamydiasis', what is an important preventive measure for a healthy society?",Using condoms during coitus and avoiding unknown partners.,Avoiding vaccination.,Using copper IUDs.,Sharing infected needles.,A,easy
12,Biology,Reproductive Health,"Q-ID-289: Regarding the sexually transmitted infection 'Genital herpes', what is an important preventive measure for a healthy society?",Sharing infected needles.,Avoiding vaccination.,Using condoms during coitus and avoiding unknown partners.,Using copper IUDs.,C,easy
12,Biology,Reproductive Health,"Q-ID-290: Regarding the sexually transmitted infection 'Syphilis', what is an important preventive measure for a healthy society?",Sharing infected needles.,Using condoms during coitus and avoiding unknown partners.,Avoiding vaccination.,Using copper IUDs.,B,easy
12,Biology,Reproductive Health,"Q-ID-291: Regarding the sexually transmitted infection 'Genital herpes', what is an important preventive measure for a healthy society?",Using copper IUDs.,Using condoms during coitus and avoiding unknown partners.,Avoiding vaccination.,Sharing infected needles.,B,easy
12,Biology,Reproductive Health,"Q-ID-292: Regarding the sexually transmitted infection 'Genital warts', what is an important preventive measure for a healthy society?",Using copper IUDs.,Using condoms during coitus and avoiding unknown partners.,Avoiding vaccination.,Sharing infected needles.,B,easy
12,Biology,Reproductive Health,"Q-ID-293: Regarding the sexually transmitted infection 'HIV/AIDS', what is an important preventive measure for a healthy society?",Using copper IUDs.,Sharing infected needles.,Avoiding vaccination.,Using condoms during coitus and avoiding unknown partners.,D,easy
12,Biology,Reproductive Health,"Q-ID-294: Regarding the sexually transmitted infection 'Gonorrhea', what is an important preventive measure for a healthy society?",Using condoms during coitus and avoiding unknown partners.,Using copper IUDs.,Sharing infected needles.,Avoiding vaccination.,A,easy
12,Biology,Reproductive Health,"Q-ID-295: Regarding the sexually transmitted infection 'Genital warts', what is an important preventive measure for a healthy society?",Using condoms during coitus and avoiding unknown partners.,Avoiding vaccination.,Sharing infected needles.,Using copper IUDs.,A,easy
12,Biology,Reproductive Health,"Q-ID-296: Regarding the sexually transmitted infection 'Syphilis', what is an important preventive measure for a healthy society?",Using condoms during coitus and avoiding unknown partners.,Using copper IUDs.,Avoiding vaccination.,Sharing infected needles.,A,easy
12,Biology,Reproductive Health,"Q-ID-297: Regarding the sexually transmitted infection 'Trichomoniasis', what is an important preventive measure for a healthy society?",Sharing infected needles.,Avoiding vaccination.,Using condoms during coitus and avoiding unknown partners.,Using copper IUDs.,C,easy
12,Biology,Reproductive Health,"Q-ID-298: Regarding the sexually transmitted infection 'Genital herpes', what is an important preventive measure for a healthy society?",Sharing infected needles.,Using copper IUDs.,Avoiding vaccination.,Using condoms during coitus and avoiding unknown partners.,D,easy
12,Biology,Reproductive Health,"Q-ID-299: Regarding the sexually transmitted infection 'Gonorrhea', what is an important preventive measure for a healthy society?",Using condoms during coitus and avoiding unknown partners.,Using copper IUDs.,Sharing infected needles.,Avoiding vaccination.,A,easy
12,Biology,Reproductive Health,"Q-ID-300: Regarding the sexually transmitted infection 'HIV/AIDS', what is an important preventive measure for a healthy society?",Using copper IUDs.,Using condoms during coitus and avoiding unknown partners.,Avoiding vaccination.,Sharing infected needles.,B,easy
12,Biology,Reproductive Health,"Q-ID-301: Regarding the sexually transmitted infection 'Hepatitis-B', what is an important preventive measure for a healthy society?",Using condoms during coitus and avoiding unknown partners.,Avoiding vaccination.,Using copper IUDs.,Sharing infected needles.,A,easy
12,Biology,Reproductive Health,"Q-ID-302: Regarding the sexually transmitted infection 'Syphilis', what is an important preventive measure for a healthy society?",Sharing infected needles.,Using condoms during coitus and avoiding unknown partners.,Using copper IUDs.,Avoiding vaccination.,B,easy
12,Biology,Reproductive Health,"Q-ID-303: Regarding the sexually transmitted infection 'Chlamydiasis', what is an important preventive measure for a healthy society?",Avoiding vaccination.,Using condoms during coitus and avoiding unknown partners.,Sharing infected needles.,Using copper IUDs.,B,easy
12,Biology,Reproductive Health,"Q-ID-304: Regarding the sexually transmitted infection 'Syphilis', what is an important preventive measure for a healthy society?",Avoiding vaccination.,Using copper IUDs.,Using condoms during coitus and avoiding unknown partners.,Sharing infected needles.,C,easy
12,Biology,Reproductive Health,"Q-ID-305: Regarding the sexually transmitted infection 'Genital warts', what is an important preventive measure for a healthy society?",Avoiding vaccination.,Sharing infected needles.,Using condoms during coitus and avoiding unknown partners.,Using copper IUDs.,C,easy
12,Biology,Reproductive Health,"Q-ID-306: Regarding the sexually transmitted infection 'Genital herpes', what is an important preventive measure for a healthy society?",Sharing infected needles.,Using condoms during coitus and avoiding unknown partners.,Avoiding vaccination.,Using copper IUDs.,B,easy
12,Biology,Reproductive Health,"Q-ID-307: Regarding the sexually transmitted infection 'Genital herpes', what is an important preventive measure for a healthy society?",Using condoms during coitus and avoiding unknown partners.,Using copper IUDs.,Sharing infected needles.,Avoiding vaccination.,A,easy
12,Biology,Reproductive Health,"Q-ID-308: Regarding the sexually transmitted infection 'Chlamydiasis', what is an important preventive measure for a healthy society?",Sharing infected needles.,Using copper IUDs.,Avoiding vaccination.,Using condoms during coitus and avoiding unknown partners.,D,easy
12,Biology,Reproductive Health,"Q-ID-309: Regarding the sexually transmitted infection 'HIV/AIDS', what is an important preventive measure for a healthy society?",Sharing infected needles.,Using condoms during coitus and avoiding unknown partners.,Avoiding vaccination.,Using copper IUDs.,B,easy
12,Biology,Reproductive Health,"Q-ID-310: Regarding the sexually transmitted infection 'Genital herpes', what is an important preventive measure for a healthy society?",Using copper IUDs.,Sharing infected needles.,Avoiding vaccination.,Using condoms during coitus and avoiding unknown partners.,D,easy
12,Biology,Reproductive Health,"Q-ID-311: Regarding the sexually transmitted infection 'Syphilis', what is an important preventive measure for a healthy society?",Using condoms during coitus and avoiding unknown partners.,Using copper IUDs.,Sharing infected needles.,Avoiding vaccination.,A,easy
12,Biology,Reproductive Health,"Q-ID-312: Regarding the sexually transmitted infection 'Genital herpes', what is an important preventive measure for a healthy society?",Using copper IUDs.,Avoiding vaccination.,Sharing infected needles.,Using condoms during coitus and avoiding unknown partners.,D,easy
12,Biology,Reproductive Health,"Q-ID-313: Regarding the sexually transmitted infection 'Genital herpes', what is an important preventive measure for a healthy society?",Sharing infected needles.,Avoiding vaccination.,Using copper IUDs.,Using condoms during coitus and avoiding unknown partners.,D,easy
12,Biology,Reproductive Health,"Q-ID-314: Regarding the sexually transmitted infection 'Genital warts', what is an important preventive measure for a healthy society?",Sharing infected needles.,Using condoms during coitus and avoiding unknown partners.,Using copper IUDs.,Avoiding vaccination.,B,easy
12,Biology,Reproductive Health,"Q-ID-315: Regarding the sexually transmitted infection 'Chlamydiasis', what is an important preventive measure for a healthy society?",Using condoms during coitus and avoiding unknown partners.,Using copper IUDs.,Avoiding vaccination.,Sharing infected needles.,A,easy
12,Biology,Reproductive Health,"Q-ID-316: Regarding the sexually transmitted infection 'Chlamydiasis', what is an important preventive measure for a healthy society?",Avoiding vaccination.,Using copper IUDs.,Sharing infected needles.,Using condoms during coitus and avoiding unknown partners.,D,easy
